{
    "$schema": "http://json-schema.org/schema#",
    "additionalProperties": false,
    "id": "",
    "properties": {
        "authors": {
            "items": {
                "type": "string"
            },
            "type": "array",
            "uniqueItems": true
        },
        "code": {
            "type": "string"
        },
        "description": {
            "type": "string"
        },
        "label": {
            "type": "string"
        },
        "language": {
            "default": "EN",
            "oneOf": [
                {
                    "pattern": "^[A-Z]{2}$",
                    "type": "string"
                }
            ],
            "type": "string"
        },
        "mode": {
            "default": 0,
            "type": "integer"
        },
        "status": {
            "default": 0,
            "type": "integer"
        },
        "uuid": {
            "pattern": "[0-9a-f]{8}-[0-9a-f]{4}-[0-9a-f]{4}-[0-9a-f]{4}-[0-9a-f]{12}",
            "type": "string"
        }
    },
    "required": [
        "uuid",
        "code",
        "label"
    ],
    "title": "Validator for vulnerabilities used in MONARC",
    "type": "object"
}
