{"code": "602", "description": "", "label": "Absence de r\u00e8gles traitant des conditions d'usage des infrastructures de traitement de l'information (interdiction dans les locaux h\u00e9bergeant du mat\u00e9riel informatique de consommation de tabac, de boisson, d'aliments)", "language": "FR", "uuid": "69fc1c92-4591-11e9-9173-0800277f0571"}