{"code": "1165", "description": "Les utilisateurs ont-ils \u00e9t\u00e9 sensibilis\u00e9s \u00e0 la s\u00e9curit\u00e9 de l'information ?\nDes consignes unitaires ont-elles \u00e9t\u00e9 fournies par email, consigne interne, circulaire interne ... ?", "label": "Les utilisateurs ne sont pas sensibilis\u00e9s \u00e0 la s\u00e9curit\u00e9 de l'information", "language": "FR", "uuid": "69fc0421-4591-11e9-9173-0800277f0571"}