{"code": "1214", "description": "Werden die Rechte f\u00fcr den physischen Zugang zu sensiblen R\u00e4umlichkeiten regelm\u00e4\u00dfig \u00fcberpr\u00fcft?\nBenutzer? Administratoren?", "label": "Keine regelm\u00e4\u00dfige Kontrolle der Genehmigungen f\u00fcr den physischen Zugang", "language": "DE", "uuid": "69fc05bf-4591-11e9-9173-0800277f0571"}