{"code": "1179", "description": "Besteht die Gefahr von Umweltkatastrophen (Wasser, Hochwasser, Feuer, Staub, Leitungen, starke W\u00e4rmeentwicklung usw.)?\nGibt es Brandschutzt\u00fcren?\nGibt es Brandmelder? Feuerl\u00f6scher?", "label": "Die R\u00e4umlichkeiten sind nicht gesichert bzw. k\u00f6nnen von fremden Personen betreten werden.", "language": "DE", "uuid": "69fc0536-4591-11e9-9173-0800277f0571"}