{"code": "530", "description": "", "label": "Absence de consignes de bon usage des ressources informatiques afin d'\u00e9viter des comportements conduisant \u00e0 la saturation des espaces de stockage ou des ressources de traitement", "language": "FR", "uuid": "69fc1a27-4591-11e9-9173-0800277f0571"}