{"code": "41", "description": "Werden die Administratorkonten von mehreren Personen genutzt?\nSind die Administratoren immer mit ihrem Admin-Konto eingeloogt?\nIst das generische Konto \"Admin\" deaktiviert?", "label": "Fehlende Verwaltung der Zugriffsprivilegien der einzelnen Profile (Administratoren, Anwender, G\u00e4ste usw.)", "language": "DE", "uuid": "69fc166f-4591-11e9-9173-0800277f0571"}