{"code": "1216", "description": "Est-ce que les personnes normalement non autoris\u00e9es sont sous surveillance lors d'intervention exceptionnelle (internes ou externes) ?", "label": "Absence de vigilance lors d'une intervention d\u2019un tiers (fournisseur, femme de m\u00e9nage, etc.)", "language": "FR", "uuid": "69fc05d3-4591-11e9-9173-0800277f0571"}